{
  "$schema": "../../manifests/evidence-index.schema.json",
  "compatibility": {
    "content_sha256": "7902fea2205bd40674e53ce8e94105753044d27f9ff676d0cee06682be25e1fd",
    "file_sha256": "ee7dc99f93491beda374688eb244cbb1d955331ac0dba0643e7484eb90046810"
  },
  "core_id": "vice_x64",
  "local_only_evidence": true,
  "package": {
    "sha256": "d414b84404b0fb940232df2955710e3a5b8b4dd5b7aff64968a58bb77d4cd076",
    "size": 2522811
  },
  "pin_path": "pins/core-sets/vice_x64-7946cfa0d377-4b611c28b848.json",
  "publication": "disabled",
  "runs": {
    "reproduction": {
      "builds": {
        "arm64": {
          "log_sha256": "629114b754df1d7ec885054f1b6d9ca29b11e49de780f4d3326a974f7c0a9326",
          "log_size": 736371,
          "record_sha256": "7f0e1026282d0e559eb7808aeacaafd9d50a4a4285e32623aed9bd8795dfee94",
          "repository_dirty": false,
          "repository_head": "197d7cc1f9a4bb96cf9af4c7292e95a0826ee7af"
        },
        "armhf": {
          "log_sha256": "5aadd1fa569a5abe1949546e1217087aee0e83eb16293147659cf05c6ea7e1d1",
          "log_size": 739253,
          "record_sha256": "c739b00fd35649e515e47f4a0cb79bce5af5804fae22e1eb428d84a39c441b52",
          "repository_dirty": false,
          "repository_head": "197d7cc1f9a4bb96cf9af4c7292e95a0826ee7af"
        }
      },
      "e2e_content_sha256": "f8e08daea026489b8a8f34780a09cf74fa3f27014e029910ed70b56659932464",
      "e2e_file_sha256": "e3fbdced94b8f04f52fb6ab1a43b0611c611a5c4cc178d7d58c9207115124f5b",
      "run_id": "build-core-vice_x64-local-w3c"
    },
    "selected": {
      "builds": {
        "arm64": {
          "log_sha256": "1dcd0b81a22049b752e5e5e546a6fe812883ee3c4e8e5a665dbba5b996e80959",
          "log_size": 736371,
          "record_sha256": "c5dcef07f34e66f1b3ec8ca81574f7597475c261c47f978ee88a460db5713aab",
          "repository_dirty": false,
          "repository_head": "197d7cc1f9a4bb96cf9af4c7292e95a0826ee7af"
        },
        "armhf": {
          "log_sha256": "b8674e01e1a966544f7a4095a8a6e66fefeaec1c010b916d3486ce627ac4249c",
          "log_size": 739253,
          "record_sha256": "155ee6b3cd85c14cab03ddd49fa7e084457fc21c012e8e29da7378fe2e160712",
          "repository_dirty": false,
          "repository_head": "197d7cc1f9a4bb96cf9af4c7292e95a0826ee7af"
        }
      },
      "e2e_content_sha256": "799ecd52047cd2478bd7d80acd210d4e4eb0a17d281deb550311762702e3fd1c",
      "e2e_file_sha256": "a2640ffff16f48c2e379c353c08be78a3fddf89689cbe75992ee66c3bf32484f",
      "run_id": "actions-sim-build-core-vice_x64-w3c"
    }
  },
  "schema_version": 1,
  "selection_sha256": "4b611c28b84852b61e586639e13c6ab0b0a3ab88b928286b617f529acdf29992",
  "semantic_id": "vice_x64-7946cfa0d377-4b611c28b848",
  "source_commit": "7946cfa0d3775e958616d4d107de867a4616ae6c",
  "source_set_path": "pins/source-sets/vice_x64-7946cfa0d377-4b611c28b848.json",
  "targets": {
    "arm64": {
      "artifact_sha256": "2ec9bd7e0d9cdf35b43ff5e672c998fee10a79119a151b3f5d5c42f0c2d45121",
      "artifact_size": 3580888,
      "image_id": "sha256:538411e2759cd5482068fd0c1f24d5a033138cd9f49db31f2c620929a8b046a9",
      "toolchain_archive_sha256": "8a3bdd7f36a10a092209cd8f308d2d2a85e316be7ede6d42562074243b25bc64",
      "toolchain_archive_size": 502531978
    },
    "armhf": {
      "artifact_sha256": "69061cfb98940f0a66200a214a477fb7545dc1a112018acf5aa02a9d07c0780a",
      "artifact_size": 2914924,
      "image_id": "sha256:393a23661c4178edfc4e5ea0221e5de317a40f2f50a9fff1cb76e9e322189dd9",
      "toolchain_archive_sha256": "f297cbf988aeb15c3de90c1bc900494aaf4214320aa5fcfa2cbbf10d2e32f16e",
      "toolchain_archive_size": 835303648
    }
  }
}
