{
  "$schema": "../../manifests/evidence-index.schema.json",
  "compatibility": {
    "content_sha256": "d589ca619a243b0fdf2d24661f8abc0217d9fdc8e3e7262a68477b1aaacccceb",
    "file_sha256": "d18393d15bb29087529f8575f1b5ff2b58285c3a80b8f4ec17e2aaed7daf2f03"
  },
  "core_id": "gme",
  "local_only_evidence": true,
  "package": {
    "sha256": "6400132c57ed305f43c41fab3bc295a1c823afccdaf740a6c0654e21c4aa9b89",
    "size": 520909
  },
  "pin_path": "pins/core-sets/gme-818629a9fbb9-55f6c02f68eb.json",
  "publication": "disabled",
  "runs": {
    "reproduction": {
      "builds": {
        "arm64": {
          "log_sha256": "ee9a977707337942a5907e3942b7735738258ce2d84dcc0531abd5bdb8a4f3fe",
          "log_size": 25057,
          "record_sha256": "93bc3c861f9932ad0c8dec18bb7603f706985448e74034d39b40404ddae9c558",
          "repository_dirty": true,
          "repository_head": "522d210011c2908529a02a4c1a26263c17413306"
        },
        "armhf": {
          "log_sha256": "86059357b95371a6568a94626c0997c5c8e7bf17e1a5bac9137b163059fe558d",
          "log_size": 26170,
          "record_sha256": "6cb4c6baee66122ea37b8b2a7fbb232f77738a9342e65bdd4e51ae2177b688bd",
          "repository_dirty": true,
          "repository_head": "522d210011c2908529a02a4c1a26263c17413306"
        }
      },
      "e2e_content_sha256": "0ca8cb693fcda154a97ef6af5a65124523718dc156d1605e43394dbfc7bc7b03",
      "e2e_file_sha256": "e1dc0f4f92e16c3957df99147c894d61f049bdb09d24a216f1f11250a2aba8e6",
      "run_id": "build-core-gme-local-w3"
    },
    "selected": {
      "builds": {
        "arm64": {
          "log_sha256": "ee9a977707337942a5907e3942b7735738258ce2d84dcc0531abd5bdb8a4f3fe",
          "log_size": 25057,
          "record_sha256": "1f59992d092f5f8c35ba81d46c2a7f74b04ade855c8d663d64dca453e729444c",
          "repository_dirty": true,
          "repository_head": "522d210011c2908529a02a4c1a26263c17413306"
        },
        "armhf": {
          "log_sha256": "bc65278463dfc4dd0d2a254e5fd487cfacaf4bdfbaa876699754aedaab47c042",
          "log_size": 26170,
          "record_sha256": "0feb1dfb6bc680b09a24c48d76d78278803311774454c1f2a42910eab006b787",
          "repository_dirty": true,
          "repository_head": "522d210011c2908529a02a4c1a26263c17413306"
        }
      },
      "e2e_content_sha256": "4026c7c1aa1b33478ca7149291073f5ad1fe824c536979ba99737e6f5b3ba6ff",
      "e2e_file_sha256": "d76909f7354da34a2e0fa222855e3495417f30a7bb18645f0dda42d904f17e13",
      "run_id": "actions-sim-build-core-gme-w3"
    }
  },
  "schema_version": 1,
  "selection_sha256": "55f6c02f68ebbe48d287c22231a4840f6cdf40401ce5379f33ca27b5cf222074",
  "semantic_id": "gme-818629a9fbb9-55f6c02f68eb",
  "source_commit": "818629a9fbb9f99bd9c585395318834ae5c6434e",
  "source_set_path": "pins/source-sets/gme-818629a9fbb9-55f6c02f68eb.json",
  "targets": {
    "arm64": {
      "artifact_sha256": "a3df3db6da9afb2526896f9fa873127c8c770fcabfb54d3de4254ca91fdcdd35",
      "artifact_size": 920296,
      "image_id": "sha256:538411e2759cd5482068fd0c1f24d5a033138cd9f49db31f2c620929a8b046a9",
      "toolchain_archive_sha256": "8a3bdd7f36a10a092209cd8f308d2d2a85e316be7ede6d42562074243b25bc64",
      "toolchain_archive_size": 502531978
    },
    "armhf": {
      "artifact_sha256": "7683ae5d7ed18b1ad661777c9f4060d9cad39ecee60a4b5ca1d2b555dff13d4c",
      "artifact_size": 845748,
      "image_id": "sha256:393a23661c4178edfc4e5ea0221e5de317a40f2f50a9fff1cb76e9e322189dd9",
      "toolchain_archive_sha256": "f297cbf988aeb15c3de90c1bc900494aaf4214320aa5fcfa2cbbf10d2e32f16e",
      "toolchain_archive_size": 835303648
    }
  }
}
