{
  "$schema": "../../manifests/evidence-index.schema.json",
  "compatibility": {
    "content_sha256": "3fc79170dd8e678f1c789ced59d8c3e86644875cda58e41d9cc2d4a3f6909957",
    "file_sha256": "5d6c74d70a01eddfcfa25e35e72f47486492bd487216953280bd85a1e8b0bab7"
  },
  "core_id": "ffmpeg",
  "local_only_evidence": true,
  "package": {
    "sha256": "59f5dc35bbdc347f36ff011a55bf5400fc7e5f4c1dfe07528fdda161e53b9be7",
    "size": 14312652
  },
  "pin_path": "pins/core-sets/ffmpeg-4920879d2f09-453076e3b8bf.json",
  "publication": "disabled",
  "runs": {
    "reproduction": {
      "builds": {
        "arm64": {
          "log_sha256": "7e1f5a8fd7dea1cb57c537ecd2213e1a772489c7cef1331e2b9dfc01940504c1",
          "log_size": 45704366,
          "record_sha256": "3f1c7a4cf12e9041523e2c0460717694e53283a07ddf858e39cab625081afa6b",
          "repository_dirty": true,
          "repository_head": "522d210011c2908529a02a4c1a26263c17413306"
        },
        "armhf": {
          "log_sha256": "16fae4b555cbf42f4dd836046f1dfb1f4803c0a916c333f13f26f08f075196f7",
          "log_size": 46054665,
          "record_sha256": "e6ae5ecd17204d997016c4b7c579c4fc86f44617f41dd8055e22dd1d35313192",
          "repository_dirty": true,
          "repository_head": "522d210011c2908529a02a4c1a26263c17413306"
        }
      },
      "e2e_content_sha256": "a6002aed7c1f2cabb8a231f657e3806fb7a4da45ad7179d631998261950ebf62",
      "e2e_file_sha256": "5d08bfccd5b2f7b7e4fa8757a86a744bb604ed45e0c5883770c7a81c56b3d17f",
      "run_id": "build-core-ffmpeg-local-w3"
    },
    "selected": {
      "builds": {
        "arm64": {
          "log_sha256": "1fdef3e9f7511bf3b0c7c120d6937be244e21b81d5dd30b56c5987899ac58199",
          "log_size": 45704366,
          "record_sha256": "c61b68a8bd04afb40fd60c65ad10dfb10530d229ceff466d25e4b887d99b91c7",
          "repository_dirty": true,
          "repository_head": "522d210011c2908529a02a4c1a26263c17413306"
        },
        "armhf": {
          "log_sha256": "5566730a838a2471d26a536e5100f17c7671c26f2595779ce4a600595f1ab05c",
          "log_size": 46054665,
          "record_sha256": "4dd9b243a9efddf133571d2b362cb624f8aea668606201292e1d6fcd137f64bb",
          "repository_dirty": true,
          "repository_head": "522d210011c2908529a02a4c1a26263c17413306"
        }
      },
      "e2e_content_sha256": "49c4aea71591421cfc12943abc650b4109ea5c21673688b7a2f19765348bd151",
      "e2e_file_sha256": "b7749b62bf67178500d81bbe31f0761313fde52ab311758f8b315a3f09e97e3d",
      "run_id": "actions-sim-build-core-ffmpeg-w3"
    }
  },
  "schema_version": 1,
  "selection_sha256": "453076e3b8bf9b36fb1d8ce37f7c0836c7ab49e0e3fdcbd85cea5323132ab997",
  "semantic_id": "ffmpeg-4920879d2f09-453076e3b8bf",
  "source_commit": "4920879d2f09a78cdf855403c349457cee1c31da",
  "source_set_path": "pins/source-sets/ffmpeg-4920879d2f09-453076e3b8bf.json",
  "targets": {
    "arm64": {
      "artifact_sha256": "7ec466b5c3ab1aa9f20c268a5f0ea27fe723c5af62b98eaa629bccfb87bb415e",
      "artifact_size": 15950288,
      "image_id": "sha256:538411e2759cd5482068fd0c1f24d5a033138cd9f49db31f2c620929a8b046a9",
      "toolchain_archive_sha256": "8a3bdd7f36a10a092209cd8f308d2d2a85e316be7ede6d42562074243b25bc64",
      "toolchain_archive_size": 502531978
    },
    "armhf": {
      "artifact_sha256": "ca6e30534af9613eb195e639c555d9957dba9cff30c0a7778998e4c3e634b5fe",
      "artifact_size": 13544884,
      "image_id": "sha256:393a23661c4178edfc4e5ea0221e5de317a40f2f50a9fff1cb76e9e322189dd9",
      "toolchain_archive_sha256": "f297cbf988aeb15c3de90c1bc900494aaf4214320aa5fcfa2cbbf10d2e32f16e",
      "toolchain_archive_size": 835303648
    }
  }
}
